{
  "slug": "32-claude-skills-getting-started",
  "noteUrl": "https://note.com/stats47/n/nac5e44284865",
  "title": ".claude/skills 入門 — 一度うまくいった頼み方を職場の資産にする",
  "vertical": "koumuin-claude-code",
  "sourceSha256": "b7678a02704e6a7b427462482216d1cfb36d0d5c4da6634b271cedcf995ec1aa",
  "model": "claude-sonnet-5-5",
  "generatedAt": "2026-10-03T03:11:58.085Z",
  "tags": [
    "#ClaudeCode",
    "#Claudeスキル",
    "#ClaudeCodeスキル",
    "#スキル化",
    "#プロンプト",
    "#プロンプト設計",
    "#プロンプトの型",
    "#プロンプト共有",
    "#頼み方",
    "#AI活用",
    "#生成AI",
    "#生成AI活用",
    "#業務効率化",
    "#業務自動化",
    "#定型業務",
    "#定型業務の効率化",
    "#属人化",
    "#属人化解消",
    "#引き継ぎ",
    "#業務引き継ぎ",
    "#ナレッジ共有",
    "#ナレッジマネジメント",
    "#業務マニュアル",
    "#マニュアル作成",
    "#ひな形",
    "#議事録",
    "#議事録作成",
    "#議事録自動化",
    "#公用文",
    "#公用文校正",
    "#文書校正",
    "#起案文",
    "#公務員",
    "#公務員の仕事術",
    "#自治体職員",
    "#自治体DX",
    "#行政DX",
    "#DX推進",
    "#地方公務員",
    "#元公務員",
    "#公務員AI",
    "#自治体AI活用",
    "#行政実務",
    "#庁内業務",
    "#総務課",
    "#係長",
    "#新採用職員",
    "#人事異動",
    "#異動の引き継ぎ",
    "#暗黙知",
    "#形式知",
    "#業務の標準化",
    "#業務標準化",
    "#Excelマクロ",
    "#マクロとの違い",
    "#共有フォルダ",
    "#文書管理",
    "#個人情報保護",
    "#守秘義務",
    "#情報セキュリティ",
    "#AIセキュリティ",
    "#ノーコード",
    "#プログラミング不要",
    "#非エンジニア",
    "#初心者向け",
    "#入門",
    "#入門ガイド",
    "#AIエージェント",
    "#AIアシスタント",
    "#AI業務活用",
    "#文字起こし",
    "#音声文字起こし",
    "#会議の効率化",
    "#会議録",
    "#議会答弁",
    "#月次報告",
    "#前年度比較",
    "#予算資料",
    "#公文書",
    "#ライティング",
    "#文書作成",
    "#文書作成効率化",
    "#テンプレート",
    "#テンプレート化",
    "#業務テンプレート",
    "#AI研修",
    "#AI人材育成",
    "#職員研修",
    "#組織導入",
    "#組織のAI導入",
    "#働き方改革",
    "#時短術",
    "#仕事効率化",
    "#手順書",
    "#品質のばらつき",
    "#業務改善",
    "#業務改善事例",
    "#統計で見る都道府県",
    "#stats47"
  ]
}
