{
  "slug": "recovered-n03844512d58a",
  "noteUrl": "https://note.com/stats47/n/n03844512d58a",
  "title": "エンゲル係数で見る所得格差 ── 低所得層33%、高所得層25%。食費の中身はもっと違う",
  "vertical": "stats47-note",
  "sourceSha256": "f45ddd6fc2f492f9d8af6128511e90d105be0203f7955ceeefe09df2ffcbb2e6",
  "model": "claude-sonnet-5-5",
  "generatedAt": "2026-10-03T03:29:32.614Z",
  "tags": [
    "#エンゲル係数",
    "#所得格差",
    "#家計調査",
    "#年間収入五分位階級",
    "#五分位階級",
    "#食費",
    "#食料費",
    "#食料費割合",
    "#消費支出",
    "#家計",
    "#家計簿",
    "#世帯収入",
    "#低所得層",
    "#高所得層",
    "#中間層",
    "#経済格差",
    "#格差社会",
    "#教育格差",
    "#教育費",
    "#補習教育",
    "#学習塾",
    "#仕送り",
    "#外食",
    "#外食費",
    "#中食",
    "#調理食品",
    "#惣菜",
    "#菓子類",
    "#穀類",
    "#魚肉練製品",
    "#練り物",
    "#かまぼこ",
    "#光熱水道費",
    "#保健医療",
    "#酒類",
    "#総務省統計局",
    "#総務省",
    "#二人以上世帯",
    "#都道府県ランキング",
    "#都道府県別",
    "#都道府県統計",
    "#統計データ",
    "#公的統計",
    "#政府統計",
    "#統計分析",
    "#データ分析",
    "#データ可視化",
    "#オープンデータ",
    "#2024年",
    "#物価高",
    "#食料品価格",
    "#物価上昇",
    "#消費者物価",
    "#消費者物価地域差指数",
    "#貯蓄率",
    "#貯蓄",
    "#実収入",
    "#可処分所得",
    "#年収",
    "#平均年収",
    "#県民所得",
    "#地域格差",
    "#高齢化",
    "#高齢者世帯",
    "#共働き世帯",
    "#食の外部化",
    "#生活必需品",
    "#固定費",
    "#裁量的支出",
    "#家計調査年報",
    "#消費構造",
    "#支出構造",
    "#生活費",
    "#生活コスト",
    "#家計管理",
    "#家計の見直し",
    "#節約",
    "#食費節約",
    "#生活防衛",
    "#貧困",
    "#相対的貧困",
    "#社会保障",
    "#国民皆保険",
    "#医療費",
    "#自己負担",
    "#兵庫県",
    "#大阪府",
    "#青森県",
    "#埼玉県",
    "#東京都",
    "#沖縄県",
    "#ランキング",
    "#エンゲルの法則",
    "#実質手取り",
    "#暮らしのお金",
    "#時系列分析",
    "#コロナ禍",
    "#食料品",
    "#地域差"
  ]
}
