{
  "slug": "17-year-on-year-analysis",
  "noteUrl": "https://note.com/stats47/n/n5afa58e8e1e4",
  "title": "決算書類の前年比較分析を 5 分で出す手順",
  "vertical": "koumuin-claude-code",
  "sourceSha256": "3cf92566386849ba947c0d8755b2e179ac43cb3214b4d6b4b1d3f3aaa6e0372b",
  "model": "claude-sonnet-5-5",
  "generatedAt": "2026-10-03T03:11:21.954Z",
  "tags": [
    "#決算分析",
    "#前年比較",
    "#決算書類",
    "#自治体決算",
    "#決算審査",
    "#決算特別委員会",
    "#議会答弁",
    "#答弁原稿",
    "#想定問答",
    "#不用額",
    "#歳出決算",
    "#歳出科目別",
    "#款項目別",
    "#事業別決算",
    "#性質別歳出",
    "#目的別歳出",
    "#人件費",
    "#物件費",
    "#補助費等",
    "#普通建設事業費",
    "#公債費",
    "#地方債",
    "#基金繰入",
    "#繰越額",
    "#執行残",
    "#予算執行",
    "#月次予算執行状況",
    "#財政課",
    "#会計課",
    "#財政担当",
    "#会計担当",
    "#地方公務員",
    "#自治体職員",
    "#公務員",
    "#市役所",
    "#議会事務局",
    "#政策秘書",
    "#9月議会",
    "#決算期",
    "#決算統計",
    "#財務会計システム",
    "#地方財政",
    "#地方自治体",
    "#地方財政状況調査",
    "#総務省統計基準",
    "#歳出構造",
    "#歳出推移",
    "#伸び率",
    "#増減要因",
    "#要因分析",
    "#要因コメント",
    "#ピボットテーブル",
    "#Excel集計",
    "#折れ線グラフ",
    "#データ分析",
    "#データ集計",
    "#時系列分析",
    "#推移分析",
    "#ClaudeCode",
    "#Claude",
    "#生成AI",
    "#AI活用",
    "#業務効率化",
    "#業務自動化",
    "#残業削減",
    "#時短",
    "#行政DX",
    "#自治体DX",
    "#公務員DX",
    "#AI下書き",
    "#スキル化",
    "#ClaudeCodeスキル",
    "#サブエージェント",
    "#プロンプト例",
    "#議会対応",
    "#予算決算",
    "#予算編成",
    "#財政分析",
    "#財政指標",
    "#財政運営",
    "#行政評価",
    "#監査対応",
    "#情報公開",
    "#人事院勧告",
    "#物価上昇",
    "#国庫補助金",
    "#災害復旧",
    "#臨時事業",
    "#制度改正",
    "#職員数",
    "#一人あたり人件費",
    "#人件費推移",
    "#事業評価",
    "#政府統計",
    "#統計データ活用",
    "#stats47",
    "#都道府県統計",
    "#都道府県ランキング",
    "#元自治体職員"
  ]
}
