{
  "slug": "recovered-n51f946877627",
  "noteUrl": "https://note.com/stats47/n/n51f946877627",
  "title": "【2021年版】遊園地・動植物園・水族館をした人が多い県は？ 1位は愛知県｜都道府県ランキング",
  "vertical": "stats47-note",
  "sourceSha256": "351febec33938e0f5082bb67d504a420b94ce3158a1e2eb1cd117b29c5219e66",
  "model": "claude-sonnet-5-5",
  "generatedAt": "2026-10-03T03:34:53.738Z",
  "tags": [
    "#愛知県",
    "#神奈川県",
    "#京都府",
    "#東京都",
    "#大阪府",
    "#岩手県",
    "#鳥取県",
    "#青森県",
    "#徳島県",
    "#島根県",
    "#千葉県",
    "#高知県",
    "#福岡県",
    "#都道府県ランキング",
    "#都道府県別",
    "#47都道府県",
    "#社会生活基本調査",
    "#行動者率",
    "#総務省統計局",
    "#総務省",
    "#eStat",
    "#公的統計",
    "#政府統計",
    "#統計データ",
    "#2021年",
    "#遊園地",
    "#動植物園",
    "#水族館",
    "#動物園",
    "#テーマパーク",
    "#レジャー施設",
    "#レジャー",
    "#余暇活動",
    "#余暇時間",
    "#趣味",
    "#趣味娯楽",
    "#レクリエーション",
    "#東山動植物園",
    "#名古屋港水族館",
    "#レゴランド",
    "#レゴランドジャパン",
    "#ディズニーランド",
    "#USJ",
    "#海遊館",
    "#ズーラシア",
    "#八景島シーパラダイス",
    "#上野動物園",
    "#葛西臨海水族園",
    "#天王寺動物園",
    "#京都水族館",
    "#京都市動物園",
    "#偏差値",
    "#地域差",
    "#地域格差",
    "#都道府県格差",
    "#コロプレス地図",
    "#データ可視化",
    "#統計で見る都道府県",
    "#stats47",
    "#オープンデータ",
    "#データ分析",
    "#ランキング",
    "#全国平均",
    "#最下位",
    "#スポーツ観覧",
    "#愛知県民",
    "#名古屋",
    "#東海地方",
    "#東北地方",
    "#四国",
    "#山陰",
    "#三大都市圏",
    "#太平洋ベルト",
    "#関東",
    "#近畿",
    "#中国地方",
    "#コロナ禍",
    "#コロナ禍の影響",
    "#家族連れ",
    "#ファミリー層",
    "#子育て世帯",
    "#お出かけ",
    "#おでかけスポット",
    "#休日の過ごし方",
    "#観光",
    "#観光施設",
    "#地域活性化",
    "#地方創生",
    "#地域経済",
    "#マーケティング",
    "#エリアマーケティング",
    "#商圏分析",
    "#施設運営",
    "#観光政策",
    "#行政",
    "#自治体",
    "#映画鑑賞",
    "#カラオケ",
    "#キャンプ"
  ]
}
