{
  "slug": "koumuin-gis-01-depopulation-medical",
  "noteUrl": "https://note.com/stats47/n/n686dcc017bbe",
  "title": "自治体職員のためのGIS入門 — 無料の国土数値情報で「過疎地域×医療機関」を可視化する",
  "vertical": "koumuin-gis",
  "sourceSha256": "9802d83444cfe85cae89d27d1805c14ae031a484f58d3f24fb88d87c0126e409",
  "model": "claude-sonnet-5-5",
  "generatedAt": "2026-10-03T03:22:31.781Z",
  "tags": [
    "#GIS",
    "#GIS入門",
    "#地理情報システム",
    "#国土数値情報",
    "#国土交通省",
    "#過疎地域",
    "#過疎",
    "#医療機関",
    "#病院",
    "#診療所",
    "#歯科診療所",
    "#地域医療",
    "#地域医療構想",
    "#病院再編",
    "#病院統廃合",
    "#医療提供体制",
    "#医療アクセス",
    "#医療空白",
    "#自治体職員",
    "#公務員",
    "#地方公務員",
    "#自治体DX",
    "#行政実務",
    "#空間結合",
    "#空間分析",
    "#QGIS",
    "#無料GIS",
    "#オープンデータ",
    "#公的統計",
    "#都道府県別",
    "#都道府県ランキング",
    "#47都道府県",
    "#統計データ",
    "#データ可視化",
    "#地図で見る",
    "#地図可視化",
    "#統計地図",
    "#秋田県",
    "#島根県",
    "#大分県",
    "#鹿児島県",
    "#岩手県",
    "#北海道",
    "#愛媛県",
    "#和歌山県",
    "#高知県",
    "#山形県",
    "#大阪府",
    "#神奈川県",
    "#東京都",
    "#埼玉県",
    "#愛知県",
    "#滋賀県",
    "#東北",
    "#山陰",
    "#四国",
    "#九州",
    "#三大都市圏",
    "#首都圏",
    "#関西圏",
    "#中京圏",
    "#避難施設",
    "#災害危険区域",
    "#浸水想定区域",
    "#土砂災害警戒区域",
    "#防災",
    "#避難計画",
    "#ハザードマップ",
    "#地域課題",
    "#人口減少",
    "#少子高齢化",
    "#中山間地域",
    "#地方創生",
    "#地域活性化",
    "#まちづくり",
    "#福祉施設",
    "#高齢者福祉",
    "#学校",
    "#通学路",
    "#人口集中地区",
    "#行政区域",
    "#土地利用",
    "#鉄道",
    "#道路",
    "#住民説明",
    "#審議会資料",
    "#政策立案",
    "#EBPM",
    "#データ活用",
    "#データ分析",
    "#地域分析",
    "#ポリゴン",
    "#座標データ",
    "#緯度経度",
    "#過疎地域指定",
    "#医療施設",
    "#地域格差",
    "#医療政策",
    "#stats47"
  ]
}
