{
  "slug": "recovered-n04d95ae14bc1",
  "noteUrl": "https://note.com/stats47/n/n04d95ae14bc1",
  "title": "【2022年度】都道府県「実質公債費比率」ランキング｜北海道18.9%で47位、東京都はわずか1.2%",
  "vertical": "stats47-note",
  "sourceSha256": "6ae85dfe827017fc6fc243c3d5256373cb10b27d5f433d2a65b198d68c264e64",
  "model": "claude-sonnet-5-5",
  "generatedAt": "2026-10-03T03:29:48.162Z",
  "tags": [
    "#北海道",
    "#東京都",
    "#新潟県",
    "#京都府",
    "#兵庫県",
    "#秋田県",
    "#島根県",
    "#福島県",
    "#岐阜県",
    "#沖縄県",
    "#愛知県",
    "#実質公債費比率",
    "#実質公債費比率ランキング",
    "#都道府県ランキング",
    "#都道府県別",
    "#地方財政",
    "#自治体財政",
    "#財政健全化法",
    "#財政健全化指標",
    "#健全化判断比率",
    "#財政力指数",
    "#地方債",
    "#地方債現在高",
    "#起債許可",
    "#起債",
    "#借金返済",
    "#公債費",
    "#将来負担比率",
    "#経常収支比率",
    "#実質赤字比率",
    "#連結実質赤字比率",
    "#早期健全化基準",
    "#財政再生基準",
    "#地方交付税",
    "#交付税措置",
    "#地方税",
    "#自主財源比率",
    "#投資的経費",
    "#標準財政規模",
    "#総務省",
    "#社会人口統計体系",
    "#社会生活統計指標",
    "#eStat",
    "#政府統計",
    "#公的統計",
    "#統計データ",
    "#オープンデータ",
    "#偏差値",
    "#コロプレス地図",
    "#地図で見る",
    "#データ可視化",
    "#stats47",
    "#都道府県比較",
    "#地域間格差",
    "#地域差",
    "#2022年度",
    "#2022年",
    "#財政状況",
    "#財政分析",
    "#財政運営",
    "#公共投資",
    "#インフラ投資",
    "#インフラ整備",
    "#新幹線",
    "#高速道路",
    "#阪神淡路大震災",
    "#震災復興",
    "#復興特別交付税",
    "#沖縄振興",
    "#人口減少",
    "#税収",
    "#財政力",
    "#公務員",
    "#地方公務員",
    "#自治体職員",
    "#行政職員",
    "#議会質問",
    "#行政計画",
    "#政策立案",
    "#政策企画",
    "#地方債残高",
    "#借金",
    "#自治体の借金",
    "#財政再建",
    "#起債制限",
    "#総務大臣許可",
    "#公債費負担",
    "#都道府県財政",
    "#都道府県データ",
    "#日本海側",
    "#近畿",
    "#東北",
    "#関東",
    "#九州沖縄",
    "#地方自治",
    "#自治体",
    "#地方創生",
    "#行政",
    "#公共政策"
  ]
}
